{
  "schema_version": "2",
  "name": "douyin",
  "version": "0.1.0",
  "type": "compat-bridge",
  "uninstallable": true,
  "payload": "payload/douyin.ipa",
  "container": {
    "desktop": "windowed"
  },
  "protocols": ["ipa"],
  "translator": "plugins/compat/stub-runtime/translator.py",
  "capabilities": ["compat.ipa.bridge"],
  "resources": ["demo://douyin"]
}
