{
  "schema_version": "2",
  "name": "etheros-agent-rules",
  "version": "0.1.0",
  "type": "native",
  "uninstallable": false,
  "payload": "../../../.etherkit/AGENTS.md",
  "container": {
    "desktop": "windowed"
  },
  "capabilities": ["dev.agent-rules"],
  "resources": ["etherkit://agents-md"]
}
